17652997a78a4072842fb217ae4b71fb;1-12-2013 05:11;notebook gamer asus, intel coret i5 9300h, 8gb, 256gb ssd, 15,6 full hd 120hz, nvidia gtx 1650, preto - x571gt-al887t;2810589401;INFORMATICA;https://encrypted-tbn0.gstatic.com/images?q=tbn:ANd9GcSOGZIsUsLDdkF1yEZ8lNIiIwQSOI5All-KXhbGx7K4w_ErW1lv_LBUPG6YnL4JhOYPi6o&usqp=CAU;4953.87;;4;8;['-23.54150333|-46.692948330000036', 'Rua General Gois Monteiro, 369 - Vila Anglo Brasileira, Sao Paulo - SP, 05029-000, Brasil']
17652997a78a4072842fb217ae4b71fb;1-12-2013 05:11;modelador de cachos curves 1 1/4  - 31,75mm - taiff;132966721;Beleza;https://encrypted-tbn0.gstatic.com/images?q=tbn:ANd9GcSSKxRnLqayeLagXoa_iZT4xWJ5P4qupsUo0yKGZRJ-e49XDFUy8EVtjBQS9ixIkb03Pcc&usqp=CAU;224.9;;6;0;['-23.54150333|-46.692948330000036', 'Rua General Gois Monteiro, 369 - Vila Anglo Brasileira, Sao Paulo - SP, 05029-000, Brasil']
17652997a78a4072842fb217ae4b71fb;1-12-2013 05:11;multifuncional epson ecotank l3250 wi-fi - tanque de tinta;3831314107;Impresao;https://m.media-amazon.com/images/I/61minrTDZmL._AC_SX569_.jpg;1281.9;De Tinta Adaptavel;2;9;['-23.54150333|-46.692948330000036', 'Rua General Gois Monteiro, 369 - Vila Anglo Brasileira, Sao Paulo - SP, 05029-000, Brasil']
17652997a78a4072842fb217ae4b71fb;1-12-2013 05:11;notebook gamer asus, intel coret i5 9300h, 8gb, 256gb ssd, 15,6 full hd 120hz, nvidia gtx 1650, preto - x571gt-al887t;2810589401;INFORMATICA;https://encrypted-tbn0.gstatic.com/images?q=tbn:ANd9GcSOGZIsUsLDdkF1yEZ8lNIiIwQSOI5All-KXhbGx7K4w_ErW1lv_LBUPG6YnL4JhOYPi6o&usqp=CAU;4953.87;;3;1;['-23.54150333|-46.692948330000036', 'Rua General Gois Monteiro, 369 - Vila Anglo Brasileira, Sao Paulo - SP, 05029-000, Brasil']
17652997a78a4072842fb217ae4b71fb;1-12-2013 05:11;multifuncional epson ecotank l3250 wi-fi - tanque de tinta;3831314107;Impresao;https://m.media-amazon.com/images/I/61minrTDZmL._AC_SX569_.jpg;1281.9;De Tinta Adaptavel;5;8;['-23.54150333|-46.692948330000036', 'Rua General Gois Monteiro, 369 - Vila Anglo Brasileira, Sao Paulo - SP, 05029-000, Brasil']
f132ea8de66a43cab9b2f165486f9dba;1-12-2013 01:08;notebook compaq presario 420 intel pentium-n3700 4gb 120gb w10 14,1'' cinza;3252219113;INFORMATICA;https://encrypted-tbn0.gstatic.com/images?q=tbn:ANd9GcSOGZIsUsLDdkF1yEZ8lNIiIwQSOI5All-KXhbGx7K4w_ErW1lv_LBUPG6YnL4JhOYPi6o&usqp=CAU;1499.99;;5;15;['-23.6714502|-46.8075005', 'R. Feitiço da Vila, 941 - Jardim Dom Jose, Sao Paulo - SP, 05879-000, Brasil']
f132ea8de66a43cab9b2f165486f9dba;1-12-2013 01:08;multifuncional epson ecotank l3250 wi-fi - tanque de tinta;3831314107;Impresao;https://m.media-amazon.com/images/I/61minrTDZmL._AC_SX569_.jpg;1281.9;De Tinta Adaptavel;2;4;['-23.6714502|-46.8075005', 'R. Feitiço da Vila, 941 - Jardim Dom Jose, Sao Paulo - SP, 05879-000, Brasil']
