574608043fe44e2aaad31e7802f17269;26-1-2013 06:11;multifuncional epson ecotank l3250 wi-fi - tanque de tinta;3831314107;Impresao;https://m.media-amazon.com/images/I/61minrTDZmL._AC_SX569_.jpg;1281.9;De Tinta Adaptavel;9;11;['-23.54340667|-46.36945167', 'Av. Dom Pedro II, 73 - Vila Romanopolis, Ferraz de Vasconcelos - SP, 08500-400, Brasil']
574608043fe44e2aaad31e7802f17269;26-1-2013 06:11;smart tv 70 uhd samsung 4k 70au7700 processador crystal 4k tela sem limites visual livre de cabos alexa built in;3060874906;TV;https://a-static.mlcdn.com.br/618x463/smart-tv-hd-led-32-samsung-32t4300a-wi-fi-hdr-2-hdmi-1-usb/magazineluiza/225608200/68c09354fe4378c245e4e5ba097eaf4d.jpg;3999.99;;9;16;['-23.54340667|-46.36945167', 'Av. Dom Pedro II, 73 - Vila Romanopolis, Ferraz de Vasconcelos - SP, 08500-400, Brasil']
574608043fe44e2aaad31e7802f17269;26-1-2013 06:11;multifuncional epson ecotank l3250 wi-fi - tanque de tinta;3831314107;Impresao;https://m.media-amazon.com/images/I/61minrTDZmL._AC_SX569_.jpg;1281.9;De Tinta Adaptavel;8;25;['-23.54340667|-46.36945167', 'Av. Dom Pedro II, 73 - Vila Romanopolis, Ferraz de Vasconcelos - SP, 08500-400, Brasil']
574608043fe44e2aaad31e7802f17269;26-1-2013 06:11;multifuncional epson ecotank l3250 wi-fi - tanque de tinta;3831314107;Impresao;https://m.media-amazon.com/images/I/61minrTDZmL._AC_SX569_.jpg;1281.9;De Tinta Adaptavel;4;5;['-23.54340667|-46.36945167', 'Av. Dom Pedro II, 73 - Vila Romanopolis, Ferraz de Vasconcelos - SP, 08500-400, Brasil']
fcf463e7b70c4facb7432132ea692e15;26-1-2013 07:23;modelador de cachos curves 1 1/4  - 31,75mm - taiff;132966721;Beleza;https://encrypted-tbn0.gstatic.com/images?q=tbn:ANd9GcSSKxRnLqayeLagXoa_iZT4xWJ5P4qupsUo0yKGZRJ-e49XDFUy8EVtjBQS9ixIkb03Pcc&usqp=CAU;224.9;;1;18;['-23.51789833|-47.46745167', 'Alameda Dona Assunta Barisani Tienghi, 85 - Jardim America, Sorocaba - SP, 18046-705, Brasil']
fcf463e7b70c4facb7432132ea692e15;26-1-2013 07:23;notebook gamer asus, intel coret i5 9300h, 8gb, 256gb ssd, 15,6 full hd 120hz, nvidia gtx 1650, preto - x571gt-al887t;2810589401;INFORMATICA;https://encrypted-tbn0.gstatic.com/images?q=tbn:ANd9GcSOGZIsUsLDdkF1yEZ8lNIiIwQSOI5All-KXhbGx7K4w_ErW1lv_LBUPG6YnL4JhOYPi6o&usqp=CAU;4953.87;;6;10;['-23.51789833|-47.46745167', 'Alameda Dona Assunta Barisani Tienghi, 85 - Jardim America, Sorocaba - SP, 18046-705, Brasil']
